video_description,create_time,region_code,like_count,video_label,is_stem_verified,music_id,username,view_count,hashtag_names,id,share_count,video_duration,video_mention_list,comment_count,hashtag_info_list
"Blir du å holde deg inne i snøen?🌨️ 📲 Les mer på smp.no, lenke i bio ⁠ 🎥/🎬 Aleksandra Olsen ⁠ #smpno #sunnmørsposten #nyheter #sport #kultur #næringsliv #politikk #meninger #sunnmøre #nordvestlandet #hjerteforsunnmøre #vær #uvær #storm #snø #snøskred",1735834200,no,525,"{'sink': False, 'type': 0, 'vote': False, 'warn': False, 'content': ''}",False,7455346642787945248,sunnmrsposten,13535,[],7455346606750141728,115,48,[],16,[]
"Nødetatene rykket ut til Borgundvegen torsdag. 📲 Les mer på smp.no, lenke i bio ⁠ ✏️ Kristian Havnes Klemetzen, Karl-Petter Løvoll, Jan Erik Finsæther 🎥/🎬 Jan Erik Finsæther, Aleksandra Olsen ⁠ #smpno #sunnmørsposten #nyheter #sport #kultur #næringsliv #politikk #meninger #sunnmøre #nordvestlandet #hjerteforsunnmøre #brann #røykutvikling",1735826836,no,415,"{'vote': False, 'warn': False, 'content': '', 'sink': False, 'type': 0}",False,7455319508270828321,sunnmrsposten,13786,[],7455319455795612960,36,45,[],5,[]
"Bli med i SU idag! send oss en DM, en mail eller gå inn på su.no ❤️ #vennesla #politikk #memestiktok #blimed #norge #fyp ",1735824914,no,314,"{'type': 0, 'vote': False, 'warn': False, 'content': '', 'sink': False}",False,7439027824747416352,venneslasu,6226,"['fyp', 'norge', 'vennesla', 'blimed', 'politikk', 'memestiktok']",7455311220199984406,18,0,[],83,"[{'hashtag_description': '', 'hashtag_id': 229207, 'hashtag_name': 'fyp'}, {'hashtag_description': '', 'hashtag_id': 13589227, 'hashtag_name': 'vennesla'}, {'hashtag_description': '', 'hashtag_id': 40841092, 'hashtag_name': 'politikk'}, {'hashtag_description': '¡Llegaste al lugar indicado para encontrar memazos! \n\nCada viernes podrás encontrar a los 9 #MEMESTikTok oficiales de la semana.', 'hashtag_id': 1615484249350165, 'hashtag_name': 'memestiktok'}, {'hashtag_description': '', 'hashtag_id': 19898538, 'hashtag_name': 'blimed'}, {'hashtag_description': '', 'hashtag_id': 3672944, 'hashtag_name': 'norge'}]"
Det er på tide å ta bort pengene fra politikere som sløser bort vårt skattepenger med absolutt ingen skam. Hvor mye penger har gått til andre land? Hvor mange politikere har kjøpt seg jobber i andre land og organisasjoner med våre skattepenger? #StoppKorrupsjon #korrupsjon #Norge #Tiktok #TiktokNorge #Norway #politikk #embarrassing #politicaltiktok #tiktok_norway #tiktoknorwegian #skattepenger ,1735819640,no,751,"{'sink': False, 'type': 0, 'vote': False, 'warn': False, 'content': ''}",False,7386336242545281824,mr.alibaba0,11727,"['tiktok', 'embarrassing', 'norway', 'norge', 'politikk', 'tiktoknorge', 'politicaltiktok', 'tiktok_norway', 'tiktoknorwegian', 'skattepenger', 'korrupsjon', 'stoppkorrupsjon']",7455288568391421206,81,0,[],70,"[{'hashtag_name': 'stoppkorrupsjon', 'hashtag_description': '', 'hashtag_id': 7455288367446491158}, {'hashtag_id': 3672944, 'hashtag_name': 'norge', 'hashtag_description': ''}, {'hashtag_description': '', 'hashtag_id': 1627377233353733, 'hashtag_name': 'tiktoknorwegian'}, {'hashtag_id': 40841092, 'hashtag_name': 'politikk', 'hashtag_description': ''}, {'hashtag_name': 'tiktok', 'hashtag_description': '', 'hashtag_id': 23428}, {'hashtag_id': 36971, 'hashtag_name': 'embarrassing', 'hashtag_description': ''}, {'hashtag_description': 'O TikTok valoriza a criatividade e a expressão tanto quanto a autenticidade e a integridade. Manter nossos usuários seguros é nossa maior prioridade. Ao criar, visualizar ou interagir com conteúdo relacionado às eleições, lembre-se: 1. Sempre siga nossas Diretrizes da Comunidade. Elas proíbem desinformação que possa causar dano ou enganar nossos usuários e o público em geral, incluindo conteúdo sobre eleições ou outros processos cívicos. 2. Relate qualquer conteúdo que possa violar nossas Diretrizes da Comunidade. 3. Verifique a veracidade da informação utilizando recursos confiáveis como https://www.tse.jus.br/ , principalmente se você questiona a veracidade.', 'hashtag_id': 1615339486881797, 'hashtag_name': 'politicaltiktok'}, {'hashtag_description': '', 'hashtag_id': 1626355131754501, 'hashtag_name': 'tiktok_norway'}, {'hashtag_description': '', 'hashtag_id': 1664201270222853, 'hashtag_name': 'korrupsjon'}, {'hashtag_description': '', 'hashtag_id': 1658709421268997, 'hashtag_name': 'skattepenger'}, {'hashtag_id': 1611233003399174, 'hashtag_name': 'tiktoknorge', 'hashtag_description': ''}, {'hashtag_name': 'norway', 'hashtag_description': '', 'hashtag_id': 135557}]"
#norge #politikk #sv #rødt #monarkisme ,1735815950,no,110,"{'warn': False, 'content': '', 'sink': False, 'type': 0, 'vote': False}",False,7455272747799677718,klez053,4265,"['sv', 'norge', 'rødt', 'politikk', 'monarkisme']",7455272706678770966,9,241,[],35,"[{'hashtag_description': '', 'hashtag_id': 21854425, 'hashtag_name': 'rødt'}, {'hashtag_description': '', 'hashtag_id': 7191765760200015899, 'hashtag_name': 'monarkisme'}, {'hashtag_description': '', 'hashtag_id': 3672944, 'hashtag_name': 'norge'}, {'hashtag_name': 'politikk', 'hashtag_description': '', 'hashtag_id': 40841092}, {'hashtag_description': '', 'hashtag_id': 168738, 'hashtag_name': 'sv'}]"
Dette sier FrP leder Sylvi Listhaug om statsminister Jonas Gahr Støre sin nyttårstale🇧🇻🍎 #politikk #samfunn #samfunnet #frp #frpシ #frpシ💫 #sylvi #sylvilisthaug #norge #fordegside #tiktoknorge #regjeringen #stortinget #senterpartiet #vedum #jonasgahrstøre #fordeg #sosialistiskvenstreparti #ernasolberg #MDG #Venstre #Arbeiderpartiet #Høyre #stemfrp ,1735764849,no,137,"{'warn': False, 'content': '', 'sink': False, 'type': 0, 'vote': False}",False,7097538817304823810,frp2025_,3198,"['sylvi', 'norge', 'frp', 'mdg', 'venstre', 'ernasolberg', 'fordeg', 'høyre', 'regjeringen', 'stortinget', 'arbeiderpartiet', 'politikk', 'vedum', 'samfunn', 'tiktoknorge', 'fordegside', 'stemfrp', 'jonasgahrstøre', 'senterpartiet', 'sylvilisthaug', 'frpシ', 'samfunnet', 'frpシ💫', 'sosialistiskvenstreparti']",7455053242628607254,6,0,[],20,"[{'hashtag_description': '', 'hashtag_id': 7803106, 'hashtag_name': 'mdg'}, {'hashtag_description': '', 'hashtag_id': 1611233003399174, 'hashtag_name': 'tiktoknorge'}, {'hashtag_description': '', 'hashtag_id': 1674812821677062, 'hashtag_name': 'sosialistiskvenstreparti'}, {'hashtag_description': '', 'hashtag_id': 31804781, 'hashtag_name': 'arbeiderpartiet'}, {'hashtag_description': '', 'hashtag_id': 40841092, 'hashtag_name': 'politikk'}, {'hashtag_description': '', 'hashtag_id': 1670490096953349, 'hashtag_name': 'frpシ💫'}, {'hashtag_description': '', 'hashtag_id': 1644100998255621, 'hashtag_name': 'senterpartiet'}, {'hashtag_description': '', 'hashtag_id': 1621041290037253, 'hashtag_name': 'fordegside'}, {'hashtag_description': '', 'hashtag_id': 16082098, 'hashtag_name': 'regjeringen'}, {'hashtag_name': 'norge', 'hashtag_description': '', 'hashtag_id': 3672944}, {'hashtag_description': '', 'hashtag_id': 13510536, 'hashtag_name': 'venstre'}, {'hashtag_id': 1626011419935750, 'hashtag_name': 'stemfrp', 'hashtag_description': ''}, {'hashtag_description': '', 'hashtag_id': 582392, 'hashtag_name': 'sylvi'}, {'hashtag_description': '', 'hashtag_id': 1663418402423813, 'hashtag_name': 'samfunnet'}, {'hashtag_name': 'frp', 'hashtag_description': '', 'hashtag_id': 6318009}, {'hashtag_description': '', 'hashtag_id': 1653935430046725, 'hashtag_name': 'frpシ'}, {'hashtag_description': '', 'hashtag_id': 1642408755602438, 'hashtag_name': 'jonasgahrstøre'}, {'hashtag_description': '', 'hashtag_id': 13836049, 'hashtag_name': 'fordeg'}, {'hashtag_description': '', 'hashtag_id': 13747977, 'hashtag_name': 'ernasolberg'}, {'hashtag_description': '', 'hashtag_id': 1602978995822597, 'hashtag_name': 'samfunn'}, {'hashtag_description': '', 'hashtag_id': 1644305185036293, 'hashtag_name': 'sylvilisthaug'}, {'hashtag_description': '', 'hashtag_id': 22394533, 'hashtag_name': 'stortinget'}, {'hashtag_description': '', 'hashtag_id': 14006352, 'hashtag_name': 'høyre'}, {'hashtag_name': 'vedum', 'hashtag_description': '', 'hashtag_id': 1592908108875781}]"
"Har du nyttårsforsett, og eventuelt hva? 📲 Les mer på smp.no, lenke i bio ⁠ ✏️/🎬 Sandra Helsem ⁠ #smpno #sunnmørsposten #nyheter #sport #kultur #næringsliv #politikk #meninger #sunnmøre #nordvestlandet #hjerteforsunnmøre #nyttår #nyttårsforsett",1735761600,no,410,"{'content': '', 'sink': False, 'type': 0, 'vote': False, 'warn': False}",False,7455033703988005664,sunnmrsposten,18889,[],7455033654532672801,52,32,[],1,[]
"SMB Norge, interesseorganisasjonen for små og mellomstore bedrifter, har fått Respons Analyse til å gjennomføre en spørreundersøkelse hvor de har telefonintervjuet 400 personer. De fleste daglig ledere i bedrifter med over 20 millioner i omsetning. Nesten halvparten, 48 prosent, svarer at de ønsker Høyre-leder Erna Solberg som ny statsminister, ifølge en pressemelding fra SMB. Den nest største andelen, 24 prosent, er i kategorien «ikke sikker». Deretter kommer Frp-leder Sylvi Listhaug med 21 prosent. Kun 3 prosent svarer at de ønsker at Jonas Gahr Støre (Ap) skal fortsette. – Det er helt tydelig at næringslivet ønsker en annen politikk og en ny regjering etter det kommende stortingsvalget, sier administrerende direktør i SMB Norge, Jørund H. Rytman, i pressemeldingen. #Nationen #Ap #Høyre #Frp ",1735757418,no,48,"{'content': '', 'sink': False, 'type': 0, 'vote': False, 'warn': False}",False,6914938261639022593,norwegian_72,3285,"['ap', 'nationen', 'frp', 'høyre']",7455021327808875798,2,0,[],30,"[{'hashtag_description': '', 'hashtag_id': 6136996, 'hashtag_name': 'nationen'}, {'hashtag_description': '', 'hashtag_id': 59064, 'hashtag_name': 'ap'}, {'hashtag_description': '', 'hashtag_id': 14006352, 'hashtag_name': 'høyre'}, {'hashtag_description': '', 'hashtag_id': 6318009, 'hashtag_name': 'frp'}]"
#gyda #ulrike #oddeskalv #som #statsminister #politiker #som #kan #få #norge #på #rett #veg #i #politikken #og #som #norge #bør #være #på #fyp #viral_video #tiktoknorge #💯💯💯 #❤️❤️❤️ www.generasjonspartiet.no ,1735755104,no,10,"{'content': '', 'sink': False, 'type': 0, 'vote': False, 'warn': False}",False,7455011380154338070,tnbomb,1235,"['i', 'og', 'kan', 'som', 'fyp', 'veg', 'norge', 'rett', 'ulrike', 'politiker', 'være', 'gyda', 'statsminister', 'på', 'få', 'viral_video', 'bør', '❤️❤️❤️', '💯💯💯', 'tiktoknorge', 'politikken', 'oddeskalv']",7455011392928615702,0,16,[],0,"[{'hashtag_description': '', 'hashtag_id': 82867648, 'hashtag_name': 'få'}, {'hashtag_description': '', 'hashtag_id': 11476218, 'hashtag_name': 'gyda'}, {'hashtag_id': 6849708, 'hashtag_name': 'rett', 'hashtag_description': ''}, {'hashtag_description': '', 'hashtag_id': 75036, 'hashtag_name': 'kan'}, {'hashtag_description': '', 'hashtag_id': 84715653, 'hashtag_name': 'viral_video'}, {'hashtag_description': '', 'hashtag_id': 77930439, 'hashtag_name': 'statsminister'}, {'hashtag_description': '', 'hashtag_id': 10665010, 'hashtag_name': 'være'}, {'hashtag_description': '', 'hashtag_id': 159874, 'hashtag_name': 'som'}, {'hashtag_description': '', 'hashtag_id': 1592197461981190, 'hashtag_name': '❤️❤️❤️'}, {'hashtag_description': '', 'hashtag_id': 9662720, 'hashtag_name': 'ulrike'}, {'hashtag_description': '', 'hashtag_id': 82814882, 'hashtag_name': 'på'}, {'hashtag_id': 1599, 'hashtag_name': 'i', 'hashtag_description': ''}, {'hashtag_description': '', 'hashtag_id': 86077447, 'hashtag_name': 'bør'}, {'hashtag_name': 'tiktoknorge', 'hashtag_description': '', 'hashtag_id': 1611233003399174}, {'hashtag_description': '', 'hashtag_id': 552473, 'hashtag_name': 'veg'}, {'hashtag_description': '', 'hashtag_id': 21918, 'hashtag_name': 'og'}, {'hashtag_description': '', 'hashtag_id': 3672944, 'hashtag_name': 'norge'}, {'hashtag_name': '💯💯💯', 'hashtag_description': '', 'hashtag_id': 1592390660027398}, {'hashtag_description': '', 'hashtag_id': 229207, 'hashtag_name': 'fyp'}, {'hashtag_description': '', 'hashtag_id': 9829413, 'hashtag_name': 'politiker'}, {'hashtag_description': '', 'hashtag_id': 1656925205258246, 'hashtag_name': 'politikken'}, {'hashtag_description': '', 'hashtag_id': 7380709587642482720, 'hashtag_name': 'oddeskalv'}]"
"Du kan virkeliggjøre denne fremtidsvisjonen ved å stemme på Generasjonspartiet i 2025.  Hvordan skal vi få til dette? Vi skal forkorte avstanden mellom folket og de som bestemmer. Befolkningen skal kunne stemme på saker direkte i app. Det blir betatesting av appen allerede i januar. Norge trenger ikke være en del av et europeisk strømmarked som ikke fungerer. Energipolitikken har ført til større forskjeller, økt fattigdom og mindre konkurransekraft. Derfor skal vi sikre nasjonal kontroll over energiproduksjonen. Vårt mål er at folk betaler for reelle produksjons- og vedlikeholdskostnader. Vi skal aldri glemme at staten er til for oss, det er ikke vi som er til for staten. Vi skal slanke byråkratiet med 50 % ved å erstatte manuelle prosesser og papirmøller med effektive IT-løsninger, slå sammen etater som overlapper, og desentralisere makt til lokalt nivå. Vi skal ha automatiske førstegangs behandlinger av søknader, slik at man slipper nedverdigende møte hos NAV. Lov- og forskriftsforslag skal gjennom en «forenklingskontroll», og ledere skal måles på hvor mye de faktisk reduserer byråkrati, ikke på antall dokumenter de produserer. Alt vi ser rundt oss av ting vi setter pris på er et resultat av gründervirksomhet, det må vi aldri glemme. Derfor skal vi sikre at det er gode forhold for skapende mennesker i Norge. Formuesskatt på arbeidende kapital skal fjernes. Samtidig må søknadsprosesser i arealplanleggingen forkortes, så vi kan bygge flere boliger og gjøre det enklere for folk å komme seg inn på boligmarkedet. Kronen styrkes som følge av regulering av pengemengden, slanking av byråkratiet og styrket gründerpolitikk. GP støttet småbruk og egenproduksjon av mat. Ultraprosessert mat skal merkes og reklame for dette skal forbys. GP skal forby skadelige systemiske sprøytemidler, øke sukkeravgiften, samt fjerne moms på frukt, grønnsaker, egg, melk og uprosessert kjøtt. Ved å fikse rotårsakene til problemene våre får vi frihet, fremgang og felleskap. Vi tror på potensialet som bor i hvert menneske. Vi tror på deg. Du må være endringen du ønsker gjennom hvordan du stemmer i 2025. #fyp #politikk ",1735752324,no,4791,"{'content': '', 'sink': False, 'type': 0, 'vote': False, 'warn': False}",False,7454999463549455126,gydatv,79966,"['fyp', 'politikk']",7454999447165177111,553,89,[],351,"[{'hashtag_description': '', 'hashtag_id': 229207, 'hashtag_name': 'fyp'}, {'hashtag_description': '', 'hashtag_id': 40841092, 'hashtag_name': 'politikk'}]"
"Serieskaper og filmanmelder Christopher Pahles forslag til kulturelt nyttårsforsett for politikere, media, kulturfeltet og oss alle i 2025. 1. Mitt forslag til kulturelt nyttårsfortsett for politikere: At i hvert fall noen av dere tør å ta eierskap til kultur som politisk kampsak. At dere tør å være synlige, og står på barrikadene og kjemper for kulturen. At dere viser at den er en essensiell del av oss. Som er verdt å slåss for, å prioritere, å investere i. Og at man da ikke bare vil få økonomisk gevinst tilbake, men også et rausere, rikere og mer robust samfunn. 2. Mitt forslag til kulturforsett for media: At dere normaliserer det å prate om kultur igjen. At dere tar på dere samfunnsoppgaven med å vise at en del av det å skape en levende kultur, er å snakke om den. At dere aktivt bestemmer dere for å finne nye, spennende, gøyale måter å nå ut til folket med både kulturen i seg selv og formidlingen av den. At dere tør å stå i alt dette, trygge i at hvis dere gjør en god nok jobb og ikke gir opp før dere har begynt, vil klikkene komme. 3. Mitt forslag til kulturelt nyttårsdorsett for kulturfeltet: At kulturen gjør seg offensiv og gjeldende igjen. At vi ikke lenger aksepterer narrativet til politikere og medier osm rir populistiske strømninger og tvinger oss på defensicen. eller venter på at noen andre skal fikse det for oss. At vi tar plassen vi fortjener. At vi snakker opp kulturen, inkludert oss selv, hverandre og alt det fantastiske som lages rundt om i landet her. Og viser at kultur ikke er lekser, grønnsaker eller kun for en privilegert elite, men smittende skaperglede, mental dessert og noe som er tilgjengelig for absolutt alle. 4. Mitt forslag til kulturelt nyttårsforsett for oss alle: At hver og en av oss nå, alene og sammen, går ut og tar et aktivt valg om at kultur er noe vi vil ha i dette landet. At vi oppsøker den, og så – minst like viktig – snakker om den etterpå. Kultur er litt som et treningsstudio for sinnet. Jada, det er januar og mørkt, det er kanksje litt ork å komme i gang, vi føler vi hverken haer tid eller overskudd, og det er så mye lettere å la være. Men irriterende nok merker vi raskt at vi får så mye igjen for det. At overskudd avler overskudd, og innsikt avler innsikt. At kultur er sosial og mental folkehelse. At den bygger muskler i sjelen. Les mer 👉 TBATBA.NO @Christopher Pahle #kulturpolitikk #nyttårsforsett #kultur #politikk #valg2025 #tbatba ",1735748756,no,19,"{'vote': False, 'warn': False, 'content': '', 'sink': False, 'type': 0}",False,6941427336970291201,tbatba.no,1033,"['kultur', 'nyttårsforsett', 'politikk', 'valg2025', 'tbatba', 'kulturpolitikk']",7454984121215995158,6,0,['Christopher Pahle'],0,"[{'hashtag_description': '', 'hashtag_id': 7007868002792603654, 'hashtag_name': 'valg2025'}, {'hashtag_description': '', 'hashtag_id': 7167765074092752922, 'hashtag_name': 'tbatba'}, {'hashtag_description': '', 'hashtag_id': 7246418968901058586, 'hashtag_name': 'kulturpolitikk'}, {'hashtag_name': 'nyttårsforsett', 'hashtag_description': '', 'hashtag_id': 17914251}, {'hashtag_description': '', 'hashtag_id': 5879468, 'hashtag_name': 'kultur'}, {'hashtag_name': 'politikk', 'hashtag_description': '', 'hashtag_id': 40841092}]"
"Frp klager, Arbeiderpartiet gjennomfører #frp #fremskrittspartiet #arbeiderpartiet #jonasgahrstøre #sylvilisthaug #politikk #norskpolitikk #stortingsvalget2025 ",1735748593,no,9196,"{'warn': False, 'content': '', 'sink': False, 'type': 0, 'vote': False}",False,7386297820159199249,sosialdemokraten,157343,"['frp', 'arbeiderpartiet', 'politikk', 'fremskrittspartiet', 'jonasgahrstøre', 'sylvilisthaug', 'norskpolitikk', 'stortingsvalget2025']",7454983421278817558,441,38,[],624,"[{'hashtag_description': '', 'hashtag_id': 6318009, 'hashtag_name': 'frp'}, {'hashtag_description': '', 'hashtag_id': 1644305185036293, 'hashtag_name': 'sylvilisthaug'}, {'hashtag_description': '', 'hashtag_id': 31804781, 'hashtag_name': 'arbeiderpartiet'}, {'hashtag_id': 1659546929865733, 'hashtag_name': 'norskpolitikk', 'hashtag_description': ''}, {'hashtag_description': '', 'hashtag_id': 70136866, 'hashtag_name': 'fremskrittspartiet'}, {'hashtag_description': '', 'hashtag_id': 1642408755602438, 'hashtag_name': 'jonasgahrstøre'}, {'hashtag_description': '', 'hashtag_id': 40841092, 'hashtag_name': 'politikk'}, {'hashtag_description': '', 'hashtag_id': 7194530462009753606, 'hashtag_name': 'stortingsvalget2025'}]"
"Mer frihet, mindre skatt💙💙💙💙💙💙 #politikk #skatt #høyre ",1735744781,no,282,"{'vote': False, 'warn': False, 'content': '', 'sink': False, 'type': 0}",False,7454967053356010262,hoyre,13013,"['skatt', 'høyre', 'politikk']",7454967051577216278,16,47,[],82,"[{'hashtag_description': '', 'hashtag_id': 4235938, 'hashtag_name': 'skatt'}, {'hashtag_description': '', 'hashtag_id': 14006352, 'hashtag_name': 'høyre'}, {'hashtag_description': '', 'hashtag_id': 40841092, 'hashtag_name': 'politikk'}]"
«Du er så sykt woke» tar jeg bare som et stort kompliment! Jeg synes årvåkenhet mot diskriminering av minoriteter er bra👍 #woke #antiwoke #politikk #minoritet ,1735744703,no,78,"{'sink': False, 'type': 0, 'vote': False, 'warn': False, 'content': ''}",False,7454966721837796098,simenbondevik,1578,"['woke', 'politikk', 'antiwoke', 'minoritet']",7454966709762526486,1,72,[],9,"[{'hashtag_id': 28661, 'hashtag_name': 'woke', 'hashtag_description': ''}, {'hashtag_id': 1594047763978245, 'hashtag_name': 'antiwoke', 'hashtag_description': ''}, {'hashtag_id': 40841092, 'hashtag_name': 'politikk', 'hashtag_description': ''}, {'hashtag_description': '', 'hashtag_id': 1674920246927366, 'hashtag_name': 'minoritet'}]"
Hold deg til dansing Vedum🤭 #politikk #norgetiktok #norge #straffeparagraf105 #vinmonopolet #nyheter ,1735739941,no,123,"{'content': '', 'sink': False, 'type': 0, 'vote': False, 'warn': False}",False,6921422320242264066,stpablo88,7969,"['norge', 'vinmonopolet', 'nyheter', 'politikk', 'norgetiktok', 'straffeparagraf105']",7454946265109974294,5,42,[],19,"[{'hashtag_name': 'straffeparagraf105', 'hashtag_description': '', 'hashtag_id': 7453603687148027926}, {'hashtag_description': '', 'hashtag_id': 16521702, 'hashtag_name': 'vinmonopolet'}, {'hashtag_description': '', 'hashtag_id': 18881846, 'hashtag_name': 'nyheter'}, {'hashtag_description': '', 'hashtag_id': 40841092, 'hashtag_name': 'politikk'}, {'hashtag_id': 1634527654390789, 'hashtag_name': 'norgetiktok', 'hashtag_description': ''}, {'hashtag_description': '', 'hashtag_id': 3672944, 'hashtag_name': 'norge'}]"
Bli med på møte i fylkestinget! ✨ Litt lang video så lov å speeda opp litt 👋🏽 #politiktiktok #bergen #vestland #norway #SV #politics #fyp #foryo #foryou #norwaytiktok #fylkestinget #vestlandet #politikk #viral_video ,1735701359,no,40,"{'content': '', 'sink': False, 'type': 0, 'vote': False, 'warn': False}",False,7172738625007422214,alexander.papas,1982,"['foryou', 'politics', 'norway', 'sv', 'fyp', 'bergen', 'foryo', 'vestlandet', 'vestland', 'politikk', 'viral_video', 'norwaytiktok', 'politiktiktok', 'fylkestinget']",7454780518115216642,0,171,[],2,"[{'hashtag_description': '', 'hashtag_id': 13996639, 'hashtag_name': 'vestlandet'}, {'hashtag_description': '', 'hashtag_id': 336803, 'hashtag_name': 'bergen'}, {'hashtag_description': '', 'hashtag_id': 1671525037102081, 'hashtag_name': 'politiktiktok'}, {'hashtag_description': '', 'hashtag_id': 21962482, 'hashtag_name': 'vestland'}, {'hashtag_description': '', 'hashtag_id': 135557, 'hashtag_name': 'norway'}, {'hashtag_name': 'norwaytiktok', 'hashtag_description': '', 'hashtag_id': 1620769954679813}, {'hashtag_description': '', 'hashtag_id': 84715653, 'hashtag_name': 'viral_video'}, {'hashtag_description': '', 'hashtag_id': 42164, 'hashtag_name': 'foryou'}, {'hashtag_description': '', 'hashtag_id': 168738, 'hashtag_name': 'sv'}, {'hashtag_name': 'fyp', 'hashtag_description': '', 'hashtag_id': 229207}, {'hashtag_id': 58843, 'hashtag_name': 'politics', 'hashtag_description': 'O TikTok valoriza a criatividade e a expressão tanto quanto a autenticidade e a integridade. Manter nossos usuários seguros é nossa maior prioridade. Ao criar, visualizar ou interagir com conteúdo relacionado às eleições, lembre-se: 1. Sempre siga nossas Diretrizes da Comunidade. Elas proíbem desinformação que possa causar dano ou enganar nossos usuários e o público em geral, incluindo conteúdo sobre eleições ou outros processos cívicos. 2. Relate qualquer conteúdo que possa violar nossas Diretrizes da Comunidade. 3. Verifique a veracidade da informação utilizando recursos confiáveis como https://www.tse.jus.br/ , principalmente se você questiona a veracidade.'}, {'hashtag_description': '', 'hashtag_id': 5349765, 'hashtag_name': 'foryo'}, {'hashtag_description': '', 'hashtag_id': 7162099641507381253, 'hashtag_name': 'fylkestinget'}, {'hashtag_description': '', 'hashtag_id': 40841092, 'hashtag_name': 'politikk'}]"
#sammensy med @Politikk&Kom m/Daniel Haugerud ,1735691592,no,5,"{'vote': False, 'warn': False, 'content': '', 'sink': False, 'type': 0}",False,7454738654368369430,bredemathisen1,309,['sammensy'],7454738604997332246,0,147,['Politikk&Kom m/Daniel Haugerud'],0,"[{'hashtag_name': 'sammensy', 'hashtag_description': '', 'hashtag_id': 7318121941695627296}]"
